<?xml version="1.0" encoding="utf-8"?>
<?xml-stylesheet type="text/xsl" href="museum.xsl"?>
<museum xmlns:xsi="http://www.w3.org/2001/XMLSchema-instance"
	xsi:noNamespaceSchemaLocation="museum.xsd">
	<name>The Virtual Art Museum</name>
	<owner>Miraj Brahmbatt</owner>
	<owner>Nathan Bullock</owner>
	<owner>Juan Arroyo</owner>
	<owner>Joshua Murphy</owner>
	<owner>Marius Ebert</owner>
	<address>www.TBD.com</address>
	<exhibit exhibitID="1" href="exhibit1/exhibit1.xml">
		<name>Renaissance Beauty</name>
		<exampleArt>../Images/Art/La_nascita_di_Venere.jpg</exampleArt>
		<startDate>2020-07-01</startDate>
		<endDate>2020-12-31</endDate>
	</exhibit>
	<exhibit exhibitID="2" href="exhibit2/exhibit2.xml">
		<name>Impressive Impressionism</name>
		<exampleArt>../Images/Art/Jour_de_pluie_Ã _Paris.jpg</exampleArt>
		<startDate>2020-07-01</startDate>
		<endDate>2021-06-31</endDate>
	</exhibit>
</museum>